{
  "schemaVersion": 2,
  "snapshotId": "55555555-5555-4555-8555-555555555555",
  "vaultId": "33333333-3333-4333-8333-333333333333",
  "createdAt": "2026-09-13T12:01:00.000Z",
  "expenses": [
    {
      "id": "11111111-1111-4111-8111-111111111111",
      "merchant": "Café Toronto ☕",
      "amountMinor": 1234,
      "currencyCode": "CAD",
      "expenseDate": "2024-02-29",
      "category": "Meals and entertainment",
      "note": "Team lunch\nReceipt reviewed locally.",
      "createdAt": "2026-09-13T12:00:00.000Z",
      "updatedAt": "2026-09-13T12:00:00.000Z"
    }
  ],
  "attachments": [
    {
      "id": "44444444-4444-4444-8444-444444444444",
      "expenseId": "11111111-1111-4111-8111-111111111111",
      "mediaType": "image/png",
      "byteCount": 70,
      "sha256": "4ff6ab670a58c14270e034e2090d9a432caa263a14e0a25785386b0c12f880b5",
      "dataBase64": "iVBORw0KGgoAAAANSUhEUgAAAAEAAAABCAYAAAAfFcSJAAAADUlEQVR4nGP4z8DwHwAFAAH/iZk9HQAAAABJRU5ErkJggg=="
    }
  ]
}
